"NDB_Number","long_name","data_source","gtin_upc","manufacturer","date_modified","date_available","ingredients_english"
"45302674","QUAKER, OLD FASHIONED WHOLE GRAIN OATS","LI","030000010204","The Quaker Oats Company","2018-03-11 06:27:23","2018-03-11 06:27:23","WHOLE GRAIN ROLLED OATS."
"45189910","ORGANIC NONFAT MILK","LI","015400192750","Western Family Foods, Inc.","2018-02-17 01:40:48","2018-02-17 01:40:48","FAT FREE ORGANIC MILK, VITAMIN D, VITAMIN A."
"45193512","DARK BROWN SUGAR","LI","011110876607","The Kroger Co.","2018-01-20 03:47:00","2018-01-20 03:47:00","SUGAR, CANE MOLASSES."
"45365651","CAGE FREE LARGE WHITE EGGS","LI","688267187407","Ahold Usa, Inc.","2018-01-19 21:19:10","2018-01-19 21:19:10",""
"45326055","NON STICK OIL SPRAY","LI","049022948570","Walgreens Co.","2017-08-11 17:34:36","2017-08-11 17:34:36","CANOLA OIL, SOY LECITHIN, DIMETHYL SILICONE (AN ANTI-FOAMING AGENT), PROPELLANT."
"45088481","IODIZED SALT","LI","024600010030","Morton Salt, Inc.","2018-05-10 07:07:52","2018-05-10 07:07:52","SALT, CALCIUM SILICATE (AN ANTICAKING AGENT), DEXTROSE, POTASSIUM IODIDE"
"45208890","WHEAT BREAD","LI","085239941232","Target Stores","2017-07-14 18:34:07","2017-07-14 18:34:07","ENRICHED WHEAT FLOUR (FLOUR, MALTED BARLEY FLOUR, REDUCED IRON, NIACIN, THIAMIN MONONITRATE [VITAMIN B1], RIBOFLAVIN [VITAMIN B2], FOLIC ACID), WATER, WHOLE WHEAT FLOUR, YEAST, HONEY, SUGAR, WHEAT GLUTEN, SALT, SOYBEAN OIL, ENRICHMENT (CALCIUM SULFATE, VITAMIN E ACETATE, VITAMIN A PALMITATE, VITAMIN D3), CALCIUM PROPIONATE (PRESERVATIVE), DATEM, MONO AND DIGLYCERIDES, GRAIN VINEGAR, SOY LECITHIN, CITRIC ACID, POTASSIUM IODATE, CALCIUM PHOSPHATE."
"45102018","BELGIOIOSO, FRESH MOZARELLA CHEESE","LI","031142006018","Belgioioso Cheese, Inc.","2017-06-25 10:46:38","2017-06-25 10:46:38","PASTEURIZED MILK, VINEGAR, ENZYMES, SALT, EXTRA VIRGIN OLIVE OIL, BASIL."
"45272510","ROMA TOMATOES","LI","040232303029","Entertainment Production House Inc.","2017-11-04 22:23:16","2017-11-04 22:23:16",""
"45079317","TEA BAGS","LI","041000731334","Lipton","2018-05-15 19:18:04","2018-05-15 19:18:04","ORANGE PEKOE AND PEKOE CUT BLACK TEA."
"45326001","HALF & HALF","LI","072730274112","Prairie Farms Dairy, Inc.","2018-02-16 18:37:47","2018-02-16 18:37:47","GRADE A MILK AND CREAM, DIPOTASSIUM PHOSPHATE."
"45365899","PURE GRANULATED SUGAR","LI","708820005426","Meijer, Inc.","2018-01-24 02:49:33","2018-01-24 02:49:33",""
"45077785","SWEET BABY LETTUCES","LI","071430010549","Dole Fresh Vegetables Inc.","2017-07-14 18:54:28","2017-07-14 18:54:28","BABY LETTUCES (GREEN ROMAINE, RED OAK, GREEN OAK, TANGO, LOLLA ROSSA, RED LEAF, RED ROMAINE, GREEN LEAF)."
"45037032","ORGANIC BLACK BEANS","LI","071524159505","La Preferida Inc","2017-07-14 19:11:23","2017-07-14 19:11:23","ORGANIC BLACK TURTLE BEANS, WATER, SEA SALT."
"45062219","SWEET ITALIAN DRESSING","LI","790228371517","Lonzerotti's Italian Products","2017-07-14 20:03:55","2017-07-14 20:03:55","SOYBEAN OIL, SUGAR, CIDER VINEGAR, ONIONS, SALT, FILTERED WATER, MUSTARD FLOUR, DEHYDRATED GARLIC, SODIUM BENZOATE AND CALCIUM DISODIUM EDTA ADDED TO PROTECT FLAVOR, SPICE AND XANTHAN GUM (PROVIDES THICKNESS)"
"45272089","WHITE GRANULATED SUGAR","LI","000946001154","Blue Chip Group Inc.","2017-08-23 07:40:48","2017-08-23 07:40:48","FINE WHITE GRANULATED SUGAR."
"45037285","HALF STICKS BUTTER","LI","034500151351","Land O'Lakes, Inc.","2017-07-14 19:21:55","2017-07-14 19:21:55","SWEET CREAM, SALT."
"45329080","PURE VANILLA EXTRACT","LI","041512086458","FIRST STREET","2018-01-19 21:59:14","2018-01-19 21:59:14","WATER, ALCOHOL, VANILLA BEAN EXTRACTIVES."
"45350947","ALL PURPOSE FLOUR","LI","041380240020","Unified Grocers, Inc.","2018-01-19 21:05:37","2018-01-19 21:05:37","BLEACHED ENRICHED WHEAT FLOUR (NIACIN, REDUCED IRON, THIAMINE MONONITRATE, RIBOFLAVIN, FOLIC ACID) ENZYME."
"45090966","BAKING POWDER","LI","099482427948","Whole Foods Market, Inc.","2018-05-03 18:27:41","2018-05-03 18:27:41","CORNSTARCH, MONOCALCIUM PHOSPHATE, BAKING SODA (SODIUM BICARBONATE)."
"45233890","ORGANIC WHOLE MILK","LI","635732277514","ACF Organics, LLC","2018-02-17 06:00:16","2018-02-17 06:00:16","ORGANIC GRADE A MILK"
"45001524","MOCHI ICE CREAM BONBONS","LI","019022128593","G. T. Japan, Inc.","2017-11-15 19:19:38","2017-11-15 19:19:38","ICE CREAM INGREDIENTS: MILK, CREAM, SUGAR, STRAWBERRIES (STRAWBERRIES, SUGAR), CORN SYRUP SOLIDS, SKIM MILK, WHEY, NATURAL FLAVOR, GUAR GUM, MONO & DIGLYCERIDES, BEET JUICE AND BEET POWDER (FOR COLOR), CELLULOSE GUM, LOCUST BEAN GUM, CARRAGEENAN. COATING INGREDIENTS: SUGAR, WATER, RICE FLOUR, TREHALOSE, EGG WHITES, BEET JUICE AND BEET POWDER (FOR COLOR), DUSTED WITH CORN & POTATO STARCH"
"45001528","CHIPOTLE BARBECUE SAUCE","LI","5051379043735","FRESH & EASY","2018-04-26 17:23:31","2018-04-26 17:23:31","WATER, SUGAR, TOMATO PASTE, MOLASSES, DISTILLED VINEGAR, CONTAINS 2% OR LESS OF: CORN STARCH, SALT, DRIED CHIPOTLE PEPPER, NATURAL SMOKE FLAVOR, MUSTARD FLOUR, DRIED GARLIC, DRIED ONION, SPICES."
"45001529","HOT & SPICY BARBECUE SAUCE","LI","5051379009434","FRESH & EASY","2018-04-26 18:17:37","2018-04-26 18:17:37","SUGAR, WATER, DISTILLED VINEGAR, TOMATO PASTE, MOLASSES, MODIFIED CORN STARCH, SALT, PINEAPPLE JUICE CONCENTRATE, CONTAINS 1% OR LESS OF: JALAPENO PEPPERS, SPICE, CARAMEL COLOR, NATURAL FLAVOR, XANTHAN GUM, GARLIC POWDER, TAMARIND EXTRACT."
"45001530","BARBECUE SAUCE","LI","5051379019969","FRESH & EASY","2018-04-26 17:24:00","2018-04-26 17:24:00","TOMATO PUREE (WATER, TOMATO PASTE), SUGAR, DISTILLED VINEGAR, MOLASSES, WATER, MODIFIED CORN STARCH, SALT, BOURBON WHISKEY, CONTAINS 1% OR LESS OF: MUSTARD FLOUR, SPICE, DRIED ONION, DRIED GARLIC, NATURAL FLAVOR, XANTHAN GUM, CARAMEL COLOR."
"45001531","BARBECUE SAUCE","LI","5051379009526","FRESH & EASY","2018-04-26 17:47:41","2018-04-26 17:47:41","SUGAR, DISTILLED VINEGAR, WATER, TOMATO PASTE, HONEY, MOLASSES, MODIFIED CORN STARCH, SALT, CONTAINS 1% OR LESS OF: NATURAL FLAVOR, PINEAPPLE JUICE CONCENTRATE, SPICE, CARAMEL COLOR, XANTHAN GUM, GARLIC POWDER, TAMARIND EXTRACT."
"45001532","ORIGINAL BARBECUE SAUCE","LI","5051379019983","FRESH & EASY","2018-04-26 18:49:53","2018-04-26 18:49:53","SUGAR, DISTILLED VINEGAR, WATER, TOMATO PASTE, MODIFIED CORN STARCH, MOLASSES, SALT, PINEAPPLE JUICE CONCENTRATE, CONTAINS 1% OR LESS OF: NATURAL FLAVOR, SPICE, CARAMEL COLOR, XANTHAN GUM, GARLIC POWDER, TAMARIND EXTRACT."
"45001533","CLASSIC BARBECUE SAUCE","LI","5051379019976","FRESH & EASY","2018-04-26 09:11:13","2018-04-26 09:11:13","SUGAR, DISTILLED VINEGAR, WATER, TOMATO PUREE (WATER, TOMATO PASTE), MOLASSES, SALT, MODIFIED CORN STARCH, CONTAINS LESS THAN 1% OF: MUSTARD FLOUR, SPICE, CELERY SEED, NATURAL FLAVOR, XANTHAN GUM, PAPRIKA (FOR COLOR), CARAMEL COLOR."
"45001534","HICKORY BARBECUE SAUCE","LI","5051379009427","FRESH & EASY","2018-04-26 09:11:42","2018-04-26 09:11:42","WATER, SUGAR, TOMATO PASTE, MOLASSES, DISTILLED VINEGAR, SALT, MODIFIED CORN STARCH, CONTAINS 1% OR LESS OF: NATURAL FLAVOR, MUSTARD FLOUR, SPICE, ONION POWDER, CARAMEL COLOR, XANTHAN GUM, GARLIC POWDER, OLEORESIN PAPRIKA."
"45001535","STEAK SAUCE","LI","5051379020064","FRESH & EASY","2018-04-26 09:26:17","2018-04-26 09:26:17","TOMATO PUREE, ONION PUREE, SUGAR, MOLASSES, DISTILLED VINEGAR, HORSERADISH, SALT, SOYBEAN OIL, ORANGE JUICE CONCENTRATE, LEMON JUICE CONCENTRATE, ANCHOVY PASTE (ANCHOVY, OLIVE OIL, ACETIC ACID), ROASTED GARLIC PUREE (GARLIC, WATER, NATURAL FLAVOR, CITRIC ACID), NATURAL FLAVOR, JALAPENO PUREE (JALAPENO CHILE, DISTILLED VINEGAR, SALT), SOY SAUCE (WATER, WHEAT, SOYBEAN, SALT), CHILI POWDER, MUSTARD FLOUR, XANTHAN GUM, BLACK PEPPER, CARAMEL COLORING, CLOVE POWDER."
"45001536","FRESH & EASY, OUR FLAVORFUL MUSTARD IS PERFECT FOR SAVORY SANDWICHES, MEATS OR SNACKS","LI","5051379035044","FRESH & EASY","2017-09-20 01:01:09","2017-09-20 01:01:09","ORGANIC GRAIN VINEGAR, WATER, ORGANIC MUSTARD SEED, SALT, ORGANIC TURMERIC, ORGANIC PAPRIKA, ORGANIC SPICES."
"45001537","FRESH & EASY, SWEET HOT MUSTARD","LI","5051379019914","FRESH & EASY","2018-04-26 10:26:11","2018-04-26 10:26:11","DISTILLED VINEGAR, WATER, HONEY, MUSTARD FLOUR, MUSTARD SEED, SALT, SPICE."
"45001538","STONEGROUND HORSERADISH MUSTARD","LI","5051379019921","FRESH & EASY","2017-09-20 00:22:11","2017-09-20 00:22:11","DISTILLED VINEGAR, WATER, MUSTARD SEED, SALT, HORSERADISH, SOYBEAN OIL, SPICES, MUSTARD OIL."
"45001539","ORGANIC DIJON MUSTARD","LI","5051379064631","FRESH & EASY","2017-09-19 22:03:58","2017-09-19 22:03:58","ORGANIC DISTILLED VINEGAR, WATER, ORGANIC MUSTARD SEED, SALT, ORGANIC TURMERIC, ORGANIC SPICE."
"45001542","DIJON MUSTARD","LI","5051379006907","FRESH & EASY","2017-09-20 00:39:29","2017-09-20 00:39:29","DISTILLED VINEGAR, WATER, MUSTARD SEED, SALT, WHITE WINE, CITRIC ACID, TURMERIC, SPICE."
"45001543","SPICY BROWN MUSTARD","LI","5051379006891","FRESH & EASY","2017-09-20 00:31:25","2017-09-20 00:31:25","DISTILLED VINEGAR, WATER, MUSTARD SEED, SALT, TURMERIC, SPICE, NATURAL FLAVOR."
"45001544","YELLOW MUSTARD","LI","5051379006884","FRESH & EASY","2018-04-26 11:04:31","2018-04-26 11:04:31","DISTILLED VINEGAR, WATER, MUSTARD SEED, SALT, TURMERIC, PAPRIKA, SPICE."
"45001546","TOMATO KETCHUP","LI","5051379003890","FRESH & EASY","2018-04-26 11:05:08","2018-04-26 11:05:08","ORGANIC TOMATO CONCENTRATE (WATER, ORGANIC TOMATO PASTE), ORGANIC SUGAR, ORGANIC VINEGAR, SALT, ORGANIC ONION POWDER, ORGANIC SPICES."
"45001547","LITE MAYONNAISE","LI","5051379006921","FRESH & EASY","2018-04-26 10:43:56","2018-04-26 10:43:56","WATER, SOYBEAN OIL, EGGS, DISTILLED VINEGAR, FOOD STARCH MODIFIED*, CONTAINS LESS THAN 2% OF: SALT, CULTURED SUGAR*, LEMON JUICE CONCENTRATE, DL-ALPHA-TOCOPHEROL ACETATE (VITAMIN E)*, NATURAL FLAVOR."
"45001548","REAL MAYONNAISE MADE WITH CIDER VINEGAR","LI","5051379006914","FRESH & EASY","2017-12-22 02:07:07","2017-12-22 02:07:07","SOYBEAN OIL, EGGS, CIDER VINEGAR, WATER, CONTAINS LESS THAN 2% OF: SALT, SPICE, LEMON JUICE CONCENTRATE, NATURAL FLAVORS."
"45001563","FINE ICE CREAMS","LI","075209824702","McConnell's Ice Cream Inc.","2017-07-14 19:26:37","2017-07-14 19:26:37","CREAM, MILK, CANE SUGAR, NON FAT MILK SOLIDS, ORGANIC EGG YOLKS, GUITTARD COCOA, GUITTARD CHOCOLATE LIQUOR, ALMOND BRITTLE [ALMONDS, BUTTER, CANE SUGAR, SALT], R.R. LOCHHEAD VANILLA, ESPRESSO"
"45001569","STATER BROS., SUGAR POWDERED","LI","074175820206","Stater Bros. Markets Inc.","2018-04-26 09:06:02","2018-04-26 09:06:02","SUGAR, CORNSTARCH."
"45001570","STATER BROS., PURE CANE SUGAR GRANULATED","LI","074175820008","Stater Bros. Markets Inc.","2017-09-19 21:38:25","2017-09-19 21:38:25","SUGAR."
"45001572","STATER BROS., ROTINI AN ENRICHED MACARONI PRODUCT","LI","074175020705","Stater Bros. Markets Inc.","2017-10-31 22:40:28","2017-10-31 22:40:28","SEMOLINA (WHEAT), DURUM FLOUR (WHEAT), NIACIN, FERROUS SULFATE (IRON), THIAMIN MONONITRATE, RIBOFLAVIN, FOLIC ACID."
"45001574","STATER BROS., KIDNEY BEANS, DARK RED","LI","074175611637","Stater Bros. Markets Inc.","2018-04-26 12:01:17","2018-04-26 12:01:17","PREPARED DARK RED KIDNEY BEANS, WATER, SUGAR, SALT, CALCIUM CHLORIDE (FIRMING AGENT), DISODIUM EDTA (FOR COLOR RETENTION)."
"45001576","NON-STICK OLIVE OIL COOKING SPRAY","LI","041250003106","Meijer, Inc.","2018-05-14 04:50:23","2018-05-14 04:50:23","EXTRA VIRGIN OLIVE OIL**, SOY LECITHIN, DIMETHYL SILICONE (FOR ANTI-FOAMING)."
"45001579","SLICED SMOKED TURKEY BREAST","LI","085239266212","Target Stores","2018-05-28 19:39:27","2018-05-28 19:39:27","TURKEY BREAST, WATER, DEXTROSE, CONTAINS LESS THAN 2% OF SODIUM LACTATE, SALT, SODIUM PHOSPHATE, SODIUM NITRITE, SODIUM ERYTHORBATE, SMOKE FLAVORING, SODIUM DIACETATE."
"45001580","SLICED HONEY HAM WITH NATURAL JUICES","LI","085239266243","Target Stores","2017-07-14 20:17:44","2017-07-14 20:17:44","PORK CURED WITH WATER, HONEY, CONTAINS LESS THAN 2% OF SALT, SUGAR, BROWN SUGAR, SPICE EXTRACTIVES, SODIUM LACTATE, SODIUM PHOSPHATE, SODIUM NITRITE, SODIUM ERYTHORBATE, SODIUM DIACETATE."
"45001581","SLICED BLACK FOREST HAM","LI","085239266236","Target Stores","2018-03-11 02:23:22","2018-03-11 02:23:22","PORK CURED WITH: WATER, DEXTROSE, CONTAINS LESS THAN 2% SODIUM LACTATE, SALT, SODIUM PHOSPHATE, SODIUM ERYTHORBATE, SODIUM NITRITE, SODIUM DIACETATE."
"45001582","SLICED BLACK ANGUS ROAST BEEF","LI","085239266205","Target Stores","2018-03-11 02:26:59","2018-03-11 02:26:59","BEEF, WATER, CONTAINS LESS THAN 2% SODIUM LACTATE, SODIUM PHOSPHATE, SODIUM DIACETATE, DEXTROSE, SALT, HYDROLYZED CORN PROTEIN, ONION AND GARLIC POWDER, CANOLA OIL, NATURAL FLAVORS. COATED WITH: DEXTROSE, SALT, CARAMEL COLOR, FLAVORINGS, HYDROLYZED CORN PROTEIN, SPICES."
"45001583","MUENSTER CHEESE","LI","075925604596","Milton G. Waldbaum Company","2018-04-26 12:39:16","2018-04-26 12:39:16","PASTEURIZED MILK, CHEESE CULTURE, SALT, ENZYMES, ANNATTO (COLOR)."
"45001584","SWISS CHEESE","LI","075925604657","Milton G. Waldbaum Company","2018-04-26 13:19:43","2018-04-26 13:19:43","PASTEURIZED PART-SKIM MILK, CHEESE CULTURE, SALT, ENZYMES, NATAMYCIN (MOLD INHIBITOR)."
"45001585","HONEY MUSTARD","LI","073007109106","Columbus Manufacturing, Inc.","2017-07-14 17:47:53","2017-07-14 17:47:53","WATER, SUGAR, HONEY, WHEAT FLOUR, MUSTARD SEED, WHITE DISTILLED VINEGAR, SOYBEAN OIL, SALT, LEMON JUICE, XANTHAN GUM, EGGS, ONIONS, HIGH FRUCTOSE CORN SYRUP, CITRIC ACID, GARLIC, TURMERIC, SPICES, CALCIUM DISODIUM EDTA (RETAINS PRODUCT FRESHNESS), NATURAL FLAVOR, ANNATTO."
"45001586","SEASONED ROAST BEEF","LI","073007100301","Columbus Manufacturing, Inc.","2018-04-26 19:22:46","2018-04-26 19:22:46","BEEF, WATER, SALT, POTASSIUM LACTATE, POTASSIUM ACETATE."
"45001588","GREAT MIDWEST, CRANBERRY CHEDDAR","LI","711565011416","DCI Cheese Company, Inc.","2018-04-26 11:55:23","2018-04-26 11:55:23","CHEDDAR CHEESE (PASTEURIZED MILK, CHEESE CULTURES, SALT, ENZYMES), CRANBERRIES, SUGAR, SUNFLOWER OIL, NATURAL FLAVOR."
"45001589","GREAT MIDWEST, CHIPOTLE CHEDDAR","LI","711565011362","DCI Cheese Company, Inc.","2018-04-30 18:47:48","2018-04-30 18:47:48","CHEDDAR CHEESE (PASTEURIZED MILK, CHEESE CULTURES, SALT, ENZYMES), CHIPOTLE PEPPERS."
"45001591","TRADITIONAL HUMMUS","LI","085239233405","Target Stores","2018-03-11 02:18:21","2018-03-11 02:18:21","CHICKPEAS, WATER, SESAME TAHINI, CANOLA/OLIVE OIL BLEND, SALT, CITRIC ACID, NATURAL FLAVOR, GARLIC, SPICES, POTASSIUM SORBATE AND SODIUM BENZOATE (TO MAINTAIN FRESHNESS)."
"45001592","SUN-DRIED TOMATO & BASIL HUMMUS","LI","085239233467","Target Stores","2018-03-11 02:24:56","2018-03-11 02:24:56","CHICKPEAS, WATER, CANOLA/OLIVE OIL BLEND, SESAME TAHINI, SUNDRIED TOMATOES, LEMON JUICE CONCENTRATE, BASIL, GARLIC, SALT, SPICES, NATURAL FLAVOR, PAPRIKA EXTRACT (NATURAL FLAVORS, SOY LECITHIN), POTASSIUM SORBATE AND SODIUM BENZOATE (TO MAINTAIN FRESHNESS)."
"45001593","SPINACH & ARTICHOKE HUMMUS","LI","085239233443","Target Stores","2018-03-11 02:16:08","2018-03-11 02:16:08","CHICKPEAS, ARTICHOKE HEARTS, SESAME TAHINI, SPINACH, WATER, CANOLA/OLIVE OIL BLEND, ROASTED RED PEPPERS, SALT, CITRIC ACID, NATURAL FLAVOR, GARLIC, SPICES, POTASSIUM SORBATE AND SODIUM BENZOATE (TO MAINTAIN FRESHNESS)."
"45001594","ROASTED GARLIC HUMMUS","LI","085239233436","Target Stores","2018-03-11 02:30:00","2018-03-11 02:30:00","CHICKPEAS, WATER, SESAME TAHINI, GARLIC, CANOLA/OLIVE OIL BLEND, PIMIENTOS, SALT, CITRIC ACID, CAPERS, SPICES, VINEGAR, POTASSIUM SORBATE AND SODIUM BENZOATE (TO MAINTAIN FRESHNESS)."
"45001595","SPICY THREE PEPPER HUMMUS","LI","085239233450","Target Stores","2018-03-11 02:29:46","2018-03-11 02:29:46","CHICKPEAS, WATER, SESAME TAHINI, CANOLA/OLIVE OIL BLEND, PIMIENTOS, POBLANO PEPPERS, LEMON JUICE CONCENTRATE, JALAPENO PEPPERS, RED PEPPERS, SALT, GARLIC, SPICES, POTASSIUM SORBATE AND SODIUM BENZOATE (TO MAINTAIN FRESHNESS)."
"45001596","ROASTED RED PEPPER HUMMUS","LI","085239233429","Target Stores","2018-03-11 02:16:16","2018-03-11 02:16:16","CHICKPEAS, ROASTED RED PEPPERS, SESAME TAHINI, CANOLA/OLIVE OIL BLEND, SALT, CITRIC ACID, NATURAL FLAVOR, GARLIC, SPICES, ACACIA GUM, XANTHAN GUM, GUAR GUM, POTASSIUM SORBATE AND SODIUM BENZOATE (TO MAINTAIN FRESHNESS)."
"45001597","ROASTED GARLIC HUMMUS","LI","085239233498","Target Stores","2018-03-11 02:27:03","2018-03-11 02:27:03","CHICKPEAS, WATER, SESAME TAHINI, GARLIC, CANOLA/OLIVE OIL BLEND, PIMIENTOS, SALT, CITRIC ACID, CAPERS, SPICES, VINEGAR, POTASSIUM SORBATE AND SODIUM BENZOATE (TO MAINTAIN FRESHNESS)."
"45001598","ROASTED RED PEPPER HUMMUS","LI","085239233481","Target Stores","2018-03-11 02:26:48","2018-03-11 02:26:48","CHICKPEAS, ROASTED RED PEPPERS, SESAME TAHINI, CANOLA/OLIVE OIL BLEND, SALT, CITRIC ACID, NATURAL FLAVOR, GARLIC, SPICES, ACACIA GUM, XANTHAN GUM, GUAR GUM, POTASSIUM SORBATE AND SODIUM BENZOATE (TO MAINTAIN FRESHNESS)."
"45001599","ORGANIC TRI-COLORED TORTILLA STRIPS","LI","5051379051839","FRESH & EASY","2017-09-20 09:45:24","2017-09-20 09:45:24","ORGANIC CORN MASA FLOUR (WHITE, YELLOW, BLUE), ORGANIC VEGETABLE OIL (FROM ONE OR MORE OF: SAFFLOWER, SUNFLOWER, CANOLA), ORGANIC CHILE POWDER, ORGANIC CHIPOTLE CHILI POWDER, SALT, ORGANIC TOMATO POWDER, ORGANIC CUMIN, ORGANIC GARLIC POWDER."
"45001612","VANILLA BEAN ICE CREAM","LI","5051379049775","FRESH & EASY","2018-04-26 11:01:37","2018-04-26 11:01:37","MILK, SUGAR ,CORN SYRUP, CREAM, TAPIOCA STARCH, WHEY PROTEIN ISOLATE, MONO- AND DI-GLYCERIDES, GUAR GUM, TARA GUM, CELLULOSE GUM, XANTHAN GUM, CARRAGEENAN, DEXTROSE, NATURAL VANILLA FLAVOR, VANILLA BEAN, VITAMIN A PALMITATE."
"45001614","LIGHT ICE CREAM","LI","5051379049782","FRESH & EASY","2018-04-26 16:26:45","2018-04-26 16:26:45","MILK, SUGAR, CREAM, CHOCOLATE CHUNKS (SUGAR, COCONUT OIL, COCOA, BUTTER OIL, SOY LECITHIN, VANILLA), CORN SYRUP, NATURAL PEPPERMINT EXTRACT, TAPIOCA STARCH, WHEY PROTEIN ISOLATE, MONO- AND DI-GLYCERIDES, GUAR GUM, TARA GUM, CELLULOSE GUM, XANTHAN GUM, CARRAGEENAN, DEXTROSE, VITAMIN A PALMITATE."
"45001620","ICE CREAM","LI","5051379049751","FRESH & EASY","2018-04-30 17:31:50","2018-04-30 17:31:50","MILK, CREAM, SUGAR, CORN SYRUP, EGG CUSTARD BASE (EGG YOLK, MILK, CONDENSED MILK, SUGAR, INVERT SUGAR, BUTTER, FRUCTOSE, BROWN SUGAR, NATURAL FLAVOR, SALT, ANNATTO), EGG YOLKS, BOURBON VANILLA EXTRACT, GROUND VANILLA BEANS, CAROB GUM, GUAR GUM."
"45001624","SORBET","LI","5051379071332","FRESH & EASY","2018-04-26 17:12:04","2018-04-26 17:12:04","WATER, STRAWBERRIES, SUGAR, PINEAPPLE, PECTIN, CITRIC ACID, ASCORBIC ACID, GUAR GUM, LOCUST BEAN GUM."
"45001625","SORBET","LI","5051379071356","FRESH & EASY","2018-04-26 11:12:16","2018-04-26 11:12:16","WATER, SUGAR, LEMON JUICE, PINEAPPLE, GUAR GUM, LOCUST BEAN GUM, THYME."
"45001626","BLOOD ORANGE SORBET","LI","5051379071349","FRESH & EASY","2018-04-26 11:49:16","2018-04-26 11:49:16","WATER, SUGAR, BLOOD ORANGE JUICE, PINEAPPLE, GUAR GUM, LOCUST BEAN GUM."
"45001627","GELATO","LI","5051379071295","FRESH & EASY","2018-04-27 00:21:07","2018-04-27 00:21:07","WHOLE MILK, CREAM, SUGAR, BANANA PUREE, BROWN SUGAR, NONFAT MILK POWDER, BRANDY, CARRAGEENAN, MONO AND DI-GLYCERIDES, GUAR GUM, LOCUST BEAN GUM, SUCROSE, DEXTROSE, FRUCTOSE, BANANAS, NATURAL FLAVOR, TURMERIC EXTRACT, SOY LECITHIN."
"45001628","ICE CREAM, GELATO","LI","5051379071318","FRESH&EASY","2018-04-27 10:34:08","2018-04-27 10:34:08","WHOLE MILK, CREAM, SUGAR, GLUCOSE SYRUP, COCONUT FLOUR, WATER, NATURAL FLAVOR, CORN STARCH, SKIM MILK POWDER, CITRIC ACID, FUDGE (SUGAR, CANOLA OIL, COCOA, SKIM MILK POWDER, SOY LECITHIN), MONO- AND DI-GLYCERIDES, CARRAGEENAN, GUAR GUM, LOCUST BEAN GUM."
"45001629","GELATO","LI","5051379071301","FRESH & EASY","2018-04-30 21:31:25","2018-04-30 21:31:25","WHOLE MILK, CREAM, SUGAR, SKIM MILK POWDER, COFFEE, VEGETABLE OIL, COCOA, NATURAL FLAVORS, MONO- AND DI-GLYCERIDES, CARRAGEENAN, GUAR GUM, SOY LECITHIN, LOCUST BEAN GUM."
"45001630","GELATO","LI","5051379071271","FRESH & EASY","2018-04-26 17:09:44","2018-04-26 17:09:44","WHOLE MILK, SUGAR, CREAM, COCOA PROCESSED WITH ALKALI, SKIM MILK POWDER, COCOA LIQUOR, COCOA BUTTER, SOY LECITHIN, VANILLA EXTRACT, LOCUST BEAN GUM, GUAR GUM, CARRAGEENAN, MONO- AND DI-GLYCERIDES."
"45001632","PANKO BREAD CRUMBS JAPANESE STYLE","LI","5051379052416","FRESH & EASY","2018-04-26 11:29:24","2018-04-26 11:29:24","WHEAT FLOUR, SUGAR, YEAST, SALT."
"45001645","FRESH & EASY, CANOLA OIL","LI","5051379007478","FRESH & EASY","2018-04-26 09:16:37","2018-04-26 09:16:37","CANOLA OIL."
"45001646","FRESH & EASY, CORN OIL","LI","5051379007508","FRESH & EASY","2018-04-27 00:40:50","2018-04-27 00:40:50","CORN OIL."
"45001649","FRESH & EASY, TRI COLOR ROTINI","LI","5051379003319","FRESH & EASY","2018-04-26 19:06:36","2018-04-26 19:06:36","ORGANIC DURUM WHEAT SEMOLINA, DEHYDRATED SPINACH, DEHYDRATED TOMATO, NIACIN, FERROUS LACTATE (IRON), THIAMIN MONONITRATE, RIBOFLAVIN, FOLIC ACID."
"45001651","ENRICHED MACARONI PRODUCT, ITALIAN ORZO","LI","5051379051754","FRESH & EASY","2018-04-27 10:49:25","2018-04-27 10:49:25","ORGANIC SEMOLINA, NIACIN, FERROUS LACTATE (IRON), THIAMIN MONONITRATE, RIBOFLAVIN, FOLIC ACID."
"45001652","CONCHIGLIE","LI","5051379021184","FRESH & TASTY","2018-04-27 10:40:50","2018-04-27 10:40:50","ORGANIC DURUM WHEAT SEMOLINA, NIACIN, FERROUS LACTATE (IRON), THIAMIN MONONITRATE, RIBOFLAVIN, FOLIC ACID."
"45001653","EXCELLENT WITH MUSHROOM SAUCES","LI","5051379021160","FRESH & EASY","2018-04-26 13:25:19","2018-04-26 13:25:19","ORGANIC DURUM WHEAT SEMOLINA, NIACIN, FERROUS LACTATE (IRON), THIAMIN MONONITRATE, RIBOFLAVIN, FOLIC ACID."
"45001655","MACARONI ELBOWS","LI","5051379024802","FRESH & EASY","2018-04-26 11:01:15","2018-04-26 11:01:15","DURUM WHEAT SEMOLINA, NIACIN, FERROUS SULFATE (IRON), THIAMIN MONONITRATE, RIBOFLAVIN, FOLIC ACID."
"45001656","CUT FIDEO","LI","5051379051761","FRESH & EASY","2017-10-31 16:57:59","2017-10-31 16:57:59","DURUM SEMOLINA, NIACIN, FERROUS SULFATE (IRON), THIAMIN MONONITRATE, RIBOFLAVIN, FOLIC ACID."
"45001657","THIN SPAGHETTI","LI","5051379036294","FRESH & EASY","2018-04-26 10:54:16","2018-04-26 10:54:16","DURUM WHEAT SEMOLINA, NIACIN, FERROUS SULFATE (IRON), THIAMIN MONONITRATE, RIBOFLAVIN, FOLIC ACID."
"45001658","FETTUCCINE","LI","5051379024765","FRESH & EASY","2018-04-26 10:58:34","2018-04-26 10:58:34","DURUM WHEAT SEMOLINA, NIACIN, FERROUS SULFATE (IRON), THIAMIN MONONITRATE, RIBOFLAVIN, FOLIC ACID."
"45001659","SPAGHETTI","LI","5051379024772","FRESH & EASY","2018-04-26 09:45:38","2018-04-26 09:45:38","DURUM WHEAT SEMOLINA, NIACIN, FERROUS SULFATE (IRON), THIAMIN MONONITRATE, RIBOFLAVIN, FOLIC ACID."
"45001660","SPAGHETTI","LI","5051379034115","FRESH & EASY","2018-04-30 17:21:54","2018-04-30 17:21:54","DURUM WHEAT SEMOLINA, NIACIN, FERROUS SULFATE (IRON), THIAMIN MONONITRATE, RIBOFLAVIN, FOLIC ACID."
"45001663","ROTELLI","LI","5051379036423","FRESH & EASY","2018-04-26 17:23:16","2018-04-26 17:23:16","DURUM WHEAT SEMOLINA, NIACIN, FERROUS SULFATE (IRON), THIAMIN MONONITRATE, RIBOFLAVIN, FOLIC ACID."
"45001664","WHOLE GRAIN PASTA","LI","5051379041465","FRESH & EASY","2018-04-26 17:04:31","2018-04-26 17:04:31","WHOLE WHEAT FLOUR, DURUM WHEAT SEMOLINA, DURUM WHEAT FLOUR."
"45001665","BROWN RICE SPAGHETTI","LI","5051379021139","FRESH & EASY NEIGHBORHOOD MARKET INC.","2018-04-26 12:01:53","2018-04-26 12:01:53","BROWN RICE FLOUR, MONOGLYCERIDES, DIGLYCERIDES."
"45001666","WHOLE WHEAT SPAGHETTI","LI","5051379022266","FRESH & EASY","2018-04-26 11:48:57","2018-04-26 11:48:57","WHOLE WHEAT DURUM FLOUR."
"45001667","WHOLE WHEAT ELBOWS, MACARONI","LI","5051379022259","FRESH&EASY","2018-04-26 18:57:29","2018-04-26 18:57:29","WHOLE WHEAT DURUM FLOUR."
"45001668","WHOLE WHEAT MACARONI PRODUCT","LI","5051379022273","FRESH & EASY","2018-03-05 15:05:09","2018-03-05 15:05:09","WHOLE WHEAT DURUM FLOUR."
"45001669","BROWN RICE, ROTINI","LI","5051379021122","FRESH&EASY","2018-04-27 10:42:01","2018-04-27 10:42:01","BROWN RICE FLOUR, MONOGLYCERIDES, DIGLYCERIDES."
"45001671","LASAGNA","LI","5051379003296","FRESH & EASY","2018-04-27 10:40:42","2018-04-27 10:40:42","DURUM WHEAT SEMOLINA, NIACIN, FERROUS SULFATE (IRON), THIAMINE MONONITRATE, RIBOFLAVIN, FOLIC ACID."
"45001672","WHOLE GRAIN THIN SPAGHETTI","LI","5051379057435","FRESH & EASY","2018-04-26 18:17:27","2018-04-26 18:17:27","WHOLE DURUM WHEAT FLOUR, ENRICHED SEMOLINA [SEMOLINA NIACIN, FERROUS SULFATE (IRON), THIAMIN MONONITRATE, RIBOFLAVIN, FOLIC ACID], OAT FIBER."
"45001675","MEDIUM SHELLS","LI","5051379060336","FRESH & EASY","2018-04-26 09:45:30","2018-04-26 09:45:30","100% ORGANIC SEMOLINA."
"45001677","WHOLE GRAIN ROTINI","LI","5051379057442","FRESH&EASY","2018-04-30 14:51:36","2018-04-30 14:51:36","WHOLE DURUM WHEAT FLOUR, ENRICHED SEMOLINA [SEMOLINA, NIACIN, FERROUS SULFATE (IRON), THIAMIN MONONITRATE, RIBOFLAVIN, FOLIC ACID], OAT FIBER."
"45001678","PASTA, EXTRA BROAD RIBBONS","LI","5051379034122","FRESH&EASY","2018-04-27 10:48:34","2018-04-27 10:48:34","ENRICHED DURUM SEMOLINA [SEMOLINA, NIACIN, FERROUS SULFATE (IRON), THIAMIN MONONITRATE, RIBOFLAVIN, FOLIC ACID], CORN FLOUR, EGG WHITE."
"45001679","WIDE EGG NOODLES","LI","5051379003326","FRESH&EASY","2018-04-27 10:19:06","2018-04-27 10:19:06","DURUM WHEAT SEMOLINA, DURUM WHEAT FLOUR, EGG YOLK POWDER, NIACIN, FERROUS SULFATE (IRON), THIAMIN MONONITRATE, RIBOFLAVIN, FOLIC ACID."
"45001680","LARGE ELBOWS","LI","5051379065218","FRESH & EASY","2018-04-26 11:02:27","2018-04-26 11:02:27","SEMOLINA, NIACIN, FERROUS SULFATE (IRON), THIAMIN MONONITRATE, RIBOFLAVIN, FOLIC ACID."
"45001681","THREE CHEESE BLEND","LI","5051379050375","FRESH & EASY","2018-03-27 18:42:57","2018-03-27 18:42:57","PASTEURIZED PART-SKIM COW'S MILK, SALT, CELLULOSE (TO PREVENT CAKING), CHEESE CULTURE, ENZYMES."
"45001682","PARMESAN CHEESE","LI","5051379006006","FRESH & EASY","2017-09-20 11:33:57","2017-09-20 11:33:57","PARMESAN CHEESE (PASTEURIZED PART-SKIMMED COW'S MILK, SALT, CHEESE CULTURE, ENZYMES), CELLULOSE (TO PREVENT CAKING)."
